{"schema_version":1,"artifact_kind":"contextual-adaptive-scoring-v1","program":"bliss-playlist-optimizer","version":"0.2.6","core_api":"0.1","job_id":"synthetic-adaptive-scoring-001","request_sha256":"d52443eeb93d9a6ed2cad9d7deebf0d68b8d48b1081e36cdf4539c93d904c60a","database_sha256":"f5c3ebb9822310455621e696b15a16efb8176b746e6d7fd1882ea04ad5a59d3e","learned_matrix_sha256":"4023a86c9588df60ec2bc63e886248f7699f46980ae2e78cf6b1dd835933fbc7","semantic_evidence_sha256":"50fb96d017e3a158274763e7e908ede45cebeb85dca2591cdae5752c8570a711","algorithm_requested":"adaptive","learned_percent":20,"seed_limit":3,"parallel_execution":"rayon-indexed","source_track_ids":["track-01","track-08","track-03","track-11","track-05","track-12","track-02","track-10","track-06","track-09","track-04","track-07"],"legs":[{"position":1,"seed_start":0,"seed_track_ids":["track-01"],"candidate_track_id":"track-08","algorithm":"learned-matrix","distance":4.745355129241943},{"position":2,"seed_start":0,"seed_track_ids":["track-01","track-08"],"candidate_track_id":"track-03","algorithm":"blended(learned=20%)","distance":0.5228797197341919},{"position":3,"seed_start":0,"seed_track_ids":["track-01","track-08","track-03"],"candidate_track_id":"track-11","algorithm":"blended(learned=20%)","distance":2.438547372817993},{"position":4,"seed_start":1,"seed_track_ids":["track-08","track-03","track-11"],"candidate_track_id":"track-05","algorithm":"blended(learned=20%)","distance":0.8030480146408081},{"position":5,"seed_start":2,"seed_track_ids":["track-03","track-11","track-05"],"candidate_track_id":"track-12","algorithm":"blended(learned=20%)","distance":1.9505105018615723},{"position":6,"seed_start":3,"seed_track_ids":["track-11","track-05","track-12"],"candidate_track_id":"track-02","algorithm":"blended(learned=20%)","distance":2.5303800106048584},{"position":7,"seed_start":4,"seed_track_ids":["track-05","track-12","track-02"],"candidate_track_id":"track-10","algorithm":"blended(learned=20%)","distance":1.2696408033370972},{"position":8,"seed_start":5,"seed_track_ids":["track-12","track-02","track-10"],"candidate_track_id":"track-06","algorithm":"blended(learned=20%)","distance":0.6946220993995667},{"position":9,"seed_start":6,"seed_track_ids":["track-02","track-10","track-06"],"candidate_track_id":"track-09","algorithm":"blended(learned=20%)","distance":1.0408821105957031},{"position":10,"seed_start":7,"seed_track_ids":["track-10","track-06","track-09"],"candidate_track_id":"track-04","algorithm":"blended(learned=20%)","distance":1.5153001546859741},{"position":11,"seed_start":8,"seed_track_ids":["track-06","track-09","track-04"],"candidate_track_id":"track-07","algorithm":"blended(learned=20%)","distance":0.23213990032672882}],"transition_sum":17.743305817246437,"worst_transition":4.745355129241943,"objective":27.234016075730324}
